property_url,property_id,listing_id,mls,mls_id,status,text,style,full_street_line,street,unit,city,state,zip_code,beds,full_baths,half_baths,sqft,year_built,days_on_mls,list_price,list_price_min,list_price_max,list_date,sold_price,last_sold_date,assessed_value,estimated_value,tax,tax_history,new_construction,lot_sqft,price_per_sqft,latitude,longitude,neighborhoods,county,fips_code,stories,hoa_fee,parking_garage,agent_id,agent_name,agent_email,agent_phones,agent_mls_set,agent_nrds_id,broker_id,broker_name,builder_id,builder_name,office_id,office_mls_set,office_name,office_email,office_phones,nearby_schools,primary_photo,alt_photos
https://www.realtor.com/realestateandhomes-detail/2400-Jack-Nora-Way_Round-Rock_TX_78665_M91096-99908,9109699908,2973689527,CNTB,21A3,FOR_SALE,"The stylish two-story San Jacinto at The Hollows at Avery Centre features an inviting open-concept layout with an abundance of living space. Upon entering the home, an inviting entryway guides you to a dining area, a well-appointed kitchen and an expansive great room with direct access to the patio. As you head upstairs, you'll find two spacious secondary bedrooms-each with a walk-in closet-plus a full hall bath and a convenient laundry room. You'll also love the private owner's suite, featuring a spacious walk-in closet and an attached spa-like bath. Options may include: Covered patio",SINGLE_FAMILY,2400 Jack Nora Way,2400 Jack Nora Way,,Round Rock,TX,78665,3,2,1,1433,,18,367715,,,2025-01-22,,,,364000,,,True,,257,30.553569,-97.640545,,Williamson,48491,2,,2,,,,,,,,,4947942,Century Communities,,,,,,Round Rock Independent School District,http://nh.rdcpix.com/bf59c3d3225b9ebe729f98a8b2d6b839l-f946975607od-w480_h360_x2.webp?w=1080&q=75,"http://nh.rdcpix.com/bf59c3d3225b9ebe729f98a8b2d6b839l-f946975607od-w480_h360_x2.webp?w=1080&q=75, http://nh.rdcpix.com/bf59c3d3225b9ebe729f98a8b2d6b839t-f4190831381od-w480_h360_x2.webp?w=1080&q=75, http://nh.rdcpix.com/bf59c3d3225b9ebe729f98a8b2d6b839t-f799686878od-w480_h360_x2.webp?w=1080&q=75, http://nh.rdcpix.com/bf59c3d3225b9ebe729f98a8b2d6b839t-f3889148603od-w480_h360_x2.webp?w=1080&q=75, http://nh.rdcpix.com/bf59c3d3225b9ebe729f98a8b2d6b839t-f1487037900od-w480_h360_x2.webp?w=1080&q=75, http://nh.rdcpix.com/bf59c3d3225b9ebe729f98a8b2d6b839t-f2444218792od-w480_h360_x2.webp?w=1080&q=75, http://nh.rdcpix.com/bf59c3d3225b9ebe729f98a8b2d6b839t-f2521166248od-w480_h360_x2.webp?w=1080&q=75, http://nh.rdcpix.com/bf59c3d3225b9ebe729f98a8b2d6b839t-f3171127386od-w480_h360_x2.webp?w=1080&q=75, http://nh.rdcpix.com/bf59c3d3225b9ebe729f98a8b2d6b839t-f380057481od-w480_h360_x2.webp?w=1080&q=75"
https://www.realtor.com/realestateandhomes-detail/2332-Jack-Nora-Way_Round-Rock_TX_78665_M95065-54636,9506554636,2973689529,CNTB,23A3,FOR_SALE,"The main floor of the welcoming San Angelo plan offers an airy, open layout, showcasing a great room, a dining area, and a spacious kitchen with a center island. This level also boasts a convenient bedroom and a full bath. Upstairs, the spacious owner's suite offers a walk-in closet and a private bath with a walk-in shower. A third bedroom and a full bath round out this attractive floor plan. Options may include: Covered patio",SINGLE_FAMILY,2332 Jack Nora Way,2332 Jack Nora Way,,Round Rock,TX,78665,3,3,,1365,,18,366515,,,2025-01-22,,,,363000,,,True,,269,30.553369,-97.640535,,Williamson,48491,2,,2,,,,,,,,,4947942,Century Communities,,,,,,Round Rock Independent School District,http://nh.rdcpix.com/a963df3e6d63495654398aab352caf49l-f39539514od-w480_h360_x2.webp?w=1080&q=75,"http://nh.rdcpix.com/a963df3e6d63495654398aab352caf49l-f39539514od-w480_h360_x2.webp?w=1080&q=75, http://nh.rdcpix.com/a963df3e6d63495654398aab352caf49t-f2315091539od-w480_h360_x2.webp?w=1080&q=75, http://nh.rdcpix.com/a963df3e6d63495654398aab352caf49t-f172277274od-w480_h360_x2.webp?w=1080&q=75, http://nh.rdcpix.com/a963df3e6d63495654398aab352caf49t-f2004723142od-w480_h360_x2.webp?w=1080&q=75, http://nh.rdcpix.com/a963df3e6d63495654398aab352caf49t-f313011072od-w480_h360_x2.webp?w=1080&q=75, http://nh.rdcpix.com/a963df3e6d63495654398aab352caf49t-f2663361066od-w480_h360_x2.webp?w=1080&q=75, http://nh.rdcpix.com/a963df3e6d63495654398aab352caf49t-f2521166248od-w480_h360_x2.webp?w=1080&q=75, http://nh.rdcpix.com/a963df3e6d63495654398aab352caf49t-f3574865093od-w480_h360_x2.webp?w=1080&q=75, http://nh.rdcpix.com/a963df3e6d63495654398aab352caf49t-f3422107484od-w480_h360_x2.webp?w=1080&q=75"
https://www.realtor.com/realestateandhomes-detail/1531-N-Red-Bud-Ln-Unit-19_Round-Rock_TX_78665_M91599-56447,9159956447,2977766043,AUTX,1344336,FOR_SALE,"Last Chance! Secure 7% flex cash before its gone! Step into this stunning new construction home in the highly sought-after Chester Ranch community by Pinehurst Homes. Boasting 3 spacious bedrooms, 2.5 baths, and 1, 732 sq ft of modern living space, this home offers the perfect blend of style and functionality. The open-concept design flows effortlessly from the sophisticated kitchen with Metro Quartz Lux Noir countertops and sleek black cabinetry, to the inviting dining and living areas. The owners suite, located on the second floor, provides a serene retreat. Enjoy the private backyard, ideal for relaxing or entertaining. With hardwood floors throughout, a low tax rate of just 1.75%, and a prime location backing up to the creek, this home is a must-see!",SINGLE_FAMILY,1531 N Red Bud Ln Unit 19,1531 N Red Bud Ln,Unit 19,Round Rock,TX,78665,3,2,1,1732,2024,10,533285,,,2025-01-30,,,,528000,,,True,6490,308,30.553342,-97.61237,,Williamson,48491,2,110,2,2137125,Ana Swanson,ana@swanson-realty.com,"[{'ext': None, 'primary': True, 'type': 'Mobile', 'number': '5126868596'}]",A-AUTX-431699,795000600,4458562,Keller Williams Realty -  Broker,,,1544183,O-AUTX-099105,KW-Austin Portfolio Real Estate,operations@austinportfoliorealestate.com,"[{'number': '5129019600', 'type': 'Home', 'primary': True, 'ext': None}]","Round Rock Independent School District, Orenda Charter School",http://ap.rdcpix.com/33fd1f8913f4a37153d179a52dbb6da0l-m137556469od-w480_h360_x2.webp?w=1080&q=75,"http://ap.rdcpix.com/33fd1f8913f4a37153d179a52dbb6da0l-m137556469od-w480_h360_x2.webp?w=1080&q=75, http://ap.rdcpix.com/33fd1f8913f4a37153d179a52dbb6da0l-m3322290768od-w480_h360_x2.webp?w=1080&q=75, http://ap.rdcpix.com/33fd1f8913f4a37153d179a52dbb6da0l-m3811474581od-w480_h360_x2.webp?w=1080&q=75, http://ap.rdcpix.com/33fd1f8913f4a37153d179a52dbb6da0l-m3958857822od-w480_h360_x2.webp?w=1080&q=75, http://ap.rdcpix.com/33fd1f8913f4a37153d179a52dbb6da0l-m3190228907od-w480_h360_x2.webp?w=1080&q=75, http://ap.rdcpix.com/33fd1f8913f4a37153d179a52dbb6da0l-m934835700od-w480_h360_x2.webp?w=1080&q=75, http://ap.rdcpix.com/33fd1f8913f4a37153d179a52dbb6da0l-m886088282od-w480_h360_x2.webp?w=1080&q=75, http://ap.rdcpix.com/33fd1f8913f4a37153d179a52dbb6da0l-m926897579od-w480_h360_x2.webp?w=1080&q=75, http://ap.rdcpix.com/33fd1f8913f4a37153d179a52dbb6da0l-m2528894715od-w480_h360_x2.webp?w=1080&q=75, http://ap.rdcpix.com/33fd1f8913f4a37153d179a52dbb6da0l-m2899654829od-w480_h360_x2.webp?w=1080&q=75, http://ap.rdcpix.com/33fd1f8913f4a37153d179a52dbb6da0l-m2916138266od-w480_h360_x2.webp?w=1080&q=75"
https://www.realtor.com/realestateandhomes-detail/2271-Wallin-Bradley-Dr_Round-Rock_TX_78665_M94231-89495,9423189495,2977804164,DRHB,270-27461-274610000-0002,FOR_SALE,"Check out 2271 Wallin Bradley Drive featured in our Avery Centre community in Round Rock, TX. This home offers 2,058 square feet of living space across 4 bedrooms, 2.5 bathrooms and 2 stories. As you enter the home, you'll find a cozy dining area along with the family room and kitchen that features granite kitchen countertops, stainless steel appliances, and decorative tile backsplash giving the space an elevated look. The kitchen also includes a kitchen island and large walk-in pantry offering plenty of storage. As you make your way upstairs, you'll see the three secondary bedrooms and a full bathroom. The main bedroom is located towards the front of the home and offers a large walk-in shower and closet. This home comes included with a professionally designed landscape package and a full irrigation system as well as our Home is Connected base package that offers devices such as offers devices such as the Amazon Echo Pop, a Video Doorbell, Deako Smart Light Switch, a Honeywell Thermostat, and more. Images are representative of plan and may vary as built. Contact us today to schedule a tour at Avery Centre.",SINGLE_FAMILY,2271 Wallin Bradley Dr,2271 Wallin Bradley Dr,,Round Rock,TX,78665,4,2,1,2058,,18,429990,,,2025-01-22,,,32500,435013,7123,"[{'year': 2024, 'tax': 7123, 'assessment': {'building': None, 'land': 32500, 'total': 32500}}, {'year': 2023, 'tax': 1232, 'assessment': {'building': None, 'land': 10232, 'total': 10232}}]",True,,209,30.555305,-97.630784,,Williamson,48491,2,,2,,,,,,,,,99933687,D.R. Horton - Austin,,,,,,"Round Rock Independent School District, Orenda Charter School",http://nh.rdcpix.com/8998fa6a2f04166f8ff6fc76938f9315l-f1836511871od-w480_h360_x2.webp?w=1080&q=75,"http://nh.rdcpix.com/8998fa6a2f04166f8ff6fc76938f9315l-f1836511871od-w480_h360_x2.webp?w=1080&q=75, http://nh.rdcpix.com/8998fa6a2f04166f8ff6fc76938f9315l-f2307649004od-w480_h360_x2.webp?w=1080&q=75, http://nh.rdcpix.com/8998fa6a2f04166f8ff6fc76938f9315l-f3285460971od-w480_h360_x2.webp?w=1080&q=75, http://nh.rdcpix.com/8998fa6a2f04166f8ff6fc76938f9315l-f75045398od-w480_h360_x2.webp?w=1080&q=75, http://nh.rdcpix.com/8998fa6a2f04166f8ff6fc76938f9315l-f3912604842od-w480_h360_x2.webp?w=1080&q=75, http://nh.rdcpix.com/8998fa6a2f04166f8ff6fc76938f9315l-f3468082182od-w480_h360_x2.webp?w=1080&q=75, http://nh.rdcpix.com/8998fa6a2f04166f8ff6fc76938f9315l-f3590252140od-w480_h360_x2.webp?w=1080&q=75, http://nh.rdcpix.com/8998fa6a2f04166f8ff6fc76938f9315l-f1527562488od-w480_h360_x2.webp?w=1080&q=75, http://nh.rdcpix.com/8998fa6a2f04166f8ff6fc76938f9315l-f4166103897od-w480_h360_x2.webp?w=1080&q=75, http://nh.rdcpix.com/8998fa6a2f04166f8ff6fc76938f9315l-f3651971745od-w480_h360_x2.webp?w=1080&q=75, http://nh.rdcpix.com/8998fa6a2f04166f8ff6fc76938f9315l-f587956483od-w480_h360_x2.webp?w=1080&q=75, http://nh.rdcpix.com/8998fa6a2f04166f8ff6fc76938f9315l-f3757671385od-w480_h360_x2.webp?w=1080&q=75, http://nh.rdcpix.com/8998fa6a2f04166f8ff6fc76938f9315l-f1173741700od-w480_h360_x2.webp?w=1080&q=75, http://nh.rdcpix.com/8998fa6a2f04166f8ff6fc76938f9315l-f3768709890od-w480_h360_x2.webp?w=1080&q=75, http://nh.rdcpix.com/8998fa6a2f04166f8ff6fc76938f9315l-f493511879od-w480_h360_x2.webp?w=1080&q=75, http://nh.rdcpix.com/8998fa6a2f04166f8ff6fc76938f9315l-f3934704519od-w480_h360_x2.webp?w=1080&q=75, http://nh.rdcpix.com/8998fa6a2f04166f8ff6fc76938f9315l-f690885595od-w480_h360_x2.webp?w=1080&q=75, http://nh.rdcpix.com/8998fa6a2f04166f8ff6fc76938f9315l-f3700486419od-w480_h360_x2.webp?w=1080&q=75, http://nh.rdcpix.com/8998fa6a2f04166f8ff6fc76938f9315l-f2648783807od-w480_h360_x2.webp?w=1080&q=75, http://nh.rdcpix.com/8998fa6a2f04166f8ff6fc76938f9315l-f2097768577od-w480_h360_x2.webp?w=1080&q=75, http://nh.rdcpix.com/8998fa6a2f04166f8ff6fc76938f9315l-f3159644822od-w480_h360_x2.webp?w=1080&q=75, http://nh.rdcpix.com/8998fa6a2f04166f8ff6fc76938f9315l-f1976631824od-w480_h360_x2.webp?w=1080&q=75, http://nh.rdcpix.com/8998fa6a2f04166f8ff6fc76938f9315l-f47206434od-w480_h360_x2.webp?w=1080&q=75, http://nh.rdcpix.com/8998fa6a2f04166f8ff6fc76938f9315l-f4027243928od-w480_h360_x2.webp?w=1080&q=75, http://nh.rdcpix.com/8998fa6a2f04166f8ff6fc76938f9315l-f3368037897od-w480_h360_x2.webp?w=1080&q=75, http://nh.rdcpix.com/8998fa6a2f04166f8ff6fc76938f9315l-f2191679575od-w480_h360_x2.webp?w=1080&q=75, http://nh.rdcpix.com/8998fa6a2f04166f8ff6fc76938f9315f-f1747431023od-w480_h360_x2.webp?w=1080&q=75, http://nh.rdcpix.com/8998fa6a2f04166f8ff6fc76938f9315f-f2486210173od-w480_h360_x2.webp?w=1080&q=75, http://nh.rdcpix.com/8998fa6a2f04166f8ff6fc76938f9315f-f1382189856od-w480_h360_x2.webp?w=1080&q=75"
https://www.realtor.com/realestateandhomes-detail/1531-N-Red-Bud-Ln-Unit-34_Round-Rock_TX_78665_M93925-00628,9392500628,2977464271,AUTX,2837523,FOR_SALE,"Limited-Time Offer! 7% Flex Cash + $4K and Owners Title IncentiveAct now before its gone! Welcome to this stunning, move-in-ready home in the highly sought-after Chester Ranch Place by Pinehurst Homes! This meticulously designed property boasts 4 spacious bedrooms and 3.5 bathrooms, spread across 2, 362 square feet of modern living space. The open-concept floor plan seamlessly connects the kitchen, dining, and living areas, perfect for entertaining. The chef-inspired kitchen features a sleek island with elegant Metro Quartz Terra Luna countertops, complemented by beautiful Maple Black cabinetry. The main-level owners suite offers convenience and privacy, while every bedroom comes with its own walk-in closet. Enjoy the luxury of hardwood floors throughout and the added bonus of a low tax rate and access to top-rated Round Rock ISD. With its fantastic community setting and new construction features, this home is ready for you to move in and make it your own. Schedule your tour today!",SINGLE_FAMILY,1531 N Red Bud Ln Unit 34,1531 N Red Bud Ln,Unit 34,Round Rock,TX,78665,4,3,1,2362,2024,19,561025,,,2025-01-21,,,,537500,,,True,6490,238,30.552184,-97.613165,,Williamson,48491,2,110,2,2137125,Ana Swanson,ana@swanson-realty.com,"[{'ext': None, 'primary': True, 'type': 'Mobile', 'number': '5126868596'}]",A-AUTX-431699,795000600,4458562,Keller Williams Realty -  Broker,,,1544183,O-AUTX-099105,KW-Austin Portfolio Real Estate,operations@austinportfoliorealestate.com,"[{'number': '5129019600', 'type': 'Home', 'primary': True, 'ext': None}]","Round Rock Independent School District, Orenda Charter School",http://ap.rdcpix.com/beea04a0f4ed905895fc972577d4b2bbl-m566552245od-w480_h360_x2.webp?w=1080&q=75,"http://ap.rdcpix.com/beea04a0f4ed905895fc972577d4b2bbl-m566552245od-w480_h360_x2.webp?w=1080&q=75, http://ap.rdcpix.com/beea04a0f4ed905895fc972577d4b2bbl-m2429598819od-w480_h360_x2.webp?w=1080&q=75, http://ap.rdcpix.com/beea04a0f4ed905895fc972577d4b2bbl-m2551996953od-w480_h360_x2.webp?w=1080&q=75, http://ap.rdcpix.com/beea04a0f4ed905895fc972577d4b2bbl-m3671344174od-w480_h360_x2.webp?w=1080&q=75, http://ap.rdcpix.com/beea04a0f4ed905895fc972577d4b2bbl-m913430545od-w480_h360_x2.webp?w=1080&q=75, http://ap.rdcpix.com/beea04a0f4ed905895fc972577d4b2bbl-m2049985322od-w480_h360_x2.webp?w=1080&q=75, http://ap.rdcpix.com/beea04a0f4ed905895fc972577d4b2bbl-m977070478od-w480_h360_x2.webp?w=1080&q=75, http://ap.rdcpix.com/beea04a0f4ed905895fc972577d4b2bbl-m1997225809od-w480_h360_x2.webp?w=1080&q=75, http://ap.rdcpix.com/beea04a0f4ed905895fc972577d4b2bbl-m25904649od-w480_h360_x2.webp?w=1080&q=75, http://ap.rdcpix.com/beea04a0f4ed905895fc972577d4b2bbl-m584048416od-w480_h360_x2.webp?w=1080&q=75, http://ap.rdcpix.com/beea04a0f4ed905895fc972577d4b2bbl-m337036504od-w480_h360_x2.webp?w=1080&q=75"
https://www.realtor.com/realestateandhomes-detail/8124-Porto-Cv_Round-Rock_TX_78665_M79199-07716,7919907716,2977417890,AUTX,2610154,FOR_SALE,"Perfect Location Near Dell Diamond, Kalahari Resorts, and Old Settlers Park! Welcome to 8124 Porto Cove, Round Rock, TX, a beautiful home in the popular Siena community. Nestled on a quiet cul-de-sac, this 4-bedroom, 3-bathroom home offers a spacious layout, modern features, and easy access to top local attractions and major employers. Key Features: Primary Suite on the First Floor for ultimate convenience. Upstairs theater room and bonus space perfect for a game room or second living area. Open-concept kitchen and living area designed for entertaining. Community amenities include a pool, basketball courts, volleyball courts, and playgrounds. Prime Location Highlights: Close to Dell Diamond, Kalahari Resorts, and Old Settlers Park. Convenient to shopping, dining, and major roads. This home is perfect for families, entertainers, or anyone seeking a comfortable home in an unbeatable location. Dont waitschedule your showing today!",SINGLE_FAMILY,8124 Porto Cv,8124 Porto Cv,,Round Rock,TX,78665,4,2,1,2926,2017,20,500000,,,2025-01-20,,2017-05-16,415095,510000,10586,"[{'year': 2024, 'tax': 10586, 'assessment': {'building': None, 'land': None, 'total': 415095}}, {'year': 2023, 'tax': 10492, 'assessment': {'building': None, 'land': None, 'total': 377359}}, {'year': 2022, 'tax': 10200, 'assessment': {'building': None, 'land': None, 'total': 343054}}, {'year': 2021, 'tax': 9755, 'assessment': {'building': 250072, 'land': 61795, 'total': 311867}}, {'year': 2020, 'tax': 9272, 'assessment': {'building': 255687, 'land': 59934, 'total': 315621}}, {'year': 2019, 'tax': 9703, 'assessment': {'building': 258193, 'land': 54500, 'total': 312693}}, {'year': 2018, 'tax': 10013, 'assessment': {'building': 16400, 'land': 41000, 'total': 57400}}, {'year': 2017, 'tax': 1869, 'assessment': {'building': None, 'land': 36900, 'total': 36900}}]",False,9592,171,30.54896,-97.602481,Siena,Williamson,48491,2,25,2,1943965,Melissa Hudson,melissa.hudson@exprealty.com,"[{'ext': None, 'primary': True, 'type': 'Mobile', 'number': '5127735735'}]",A-AUTX-627476,785034589,100250952,"eXp Realty, LLC",,,100250955,O-AUTX-702963,"eXp Realty, LLC",linda.marcus@exprealty.com,"[{'number': '8885197431', 'type': 'Office', 'primary': True, 'ext': None}]","Hutto Independent School District, Orenda Charter School",http://ap.rdcpix.com/038212e018bf10d9526aa024d0566866l-m3224952597od-w480_h360_x2.webp?w=1080&q=75,"http://ap.rdcpix.com/038212e018bf10d9526aa024d0566866l-m3224952597od-w480_h360_x2.webp?w=1080&q=75, http://ap.rdcpix.com/038212e018bf10d9526aa024d0566866l-m66561881od-w480_h360_x2.webp?w=1080&q=75, http://ap.rdcpix.com/038212e018bf10d9526aa024d0566866l-m3863918165od-w480_h360_x2.webp?w=1080&q=75, http://ap.rdcpix.com/038212e018bf10d9526aa024d0566866l-m691851894od-w480_h360_x2.webp?w=1080&q=75, http://ap.rdcpix.com/038212e018bf10d9526aa024d0566866l-m3926279934od-w480_h360_x2.webp?w=1080&q=75, http://ap.rdcpix.com/038212e018bf10d9526aa024d0566866l-m2324382997od-w480_h360_x2.webp?w=1080&q=75, http://ap.rdcpix.com/038212e018bf10d9526aa024d0566866l-m607423282od-w480_h360_x2.webp?w=1080&q=75, http://ap.rdcpix.com/038212e018bf10d9526aa024d0566866l-m3369000015od-w480_h360_x2.webp?w=1080&q=75, http://ap.rdcpix.com/038212e018bf10d9526aa024d0566866l-m3413181270od-w480_h360_x2.webp?w=1080&q=75, http://ap.rdcpix.com/038212e018bf10d9526aa024d0566866l-m2890686307od-w480_h360_x2.webp?w=1080&q=75, http://ap.rdcpix.com/038212e018bf10d9526aa024d0566866l-m2276573343od-w480_h360_x2.webp?w=1080&q=75, http://ap.rdcpix.com/038212e018bf10d9526aa024d0566866l-m3277962882od-w480_h360_x2.webp?w=1080&q=75, http://ap.rdcpix.com/038212e018bf10d9526aa024d0566866l-m1691772167od-w480_h360_x2.webp?w=1080&q=75, http://ap.rdcpix.com/038212e018bf10d9526aa024d0566866l-m4251738009od-w480_h360_x2.webp?w=1080&q=75, http://ap.rdcpix.com/038212e018bf10d9526aa024d0566866l-m1497070221od-w480_h360_x2.webp?w=1080&q=75, http://ap.rdcpix.com/038212e018bf10d9526aa024d0566866l-m4116457095od-w480_h360_x2.webp?w=1080&q=75, http://ap.rdcpix.com/038212e018bf10d9526aa024d0566866l-m2272760238od-w480_h360_x2.webp?w=1080&q=75, http://ap.rdcpix.com/038212e018bf10d9526aa024d0566866l-m2280754662od-w480_h360_x2.webp?w=1080&q=75, http://ap.rdcpix.com/038212e018bf10d9526aa024d0566866l-m4236210705od-w480_h360_x2.webp?w=1080&q=75, http://ap.rdcpix.com/038212e018bf10d9526aa024d0566866l-m1446590056od-w480_h360_x2.webp?w=1080&q=75, http://ap.rdcpix.com/038212e018bf10d9526aa024d0566866l-m2134120805od-w480_h360_x2.webp?w=1080&q=75, http://ap.rdcpix.com/038212e018bf10d9526aa024d0566866l-m4243119904od-w480_h360_x2.webp?w=1080&q=75, http://ap.rdcpix.com/038212e018bf10d9526aa024d0566866l-m1452564185od-w480_h360_x2.webp?w=1080&q=75, http://ap.rdcpix.com/038212e018bf10d9526aa024d0566866l-m3792656134od-w480_h360_x2.webp?w=1080&q=75, http://ap.rdcpix.com/038212e018bf10d9526aa024d0566866l-m1837338834od-w480_h360_x2.webp?w=1080&q=75, http://ap.rdcpix.com/038212e018bf10d9526aa024d0566866l-m494667533od-w480_h360_x2.webp?w=1080&q=75, http://ap.rdcpix.com/038212e018bf10d9526aa024d0566866l-m882974841od-w480_h360_x2.webp?w=1080&q=75, http://ap.rdcpix.com/038212e018bf10d9526aa024d0566866l-m1583109856od-w480_h360_x2.webp?w=1080&q=75, http://ap.rdcpix.com/038212e018bf10d9526aa024d0566866l-m533422459od-w480_h360_x2.webp?w=1080&q=75, http://ap.rdcpix.com/038212e018bf10d9526aa024d0566866l-m2269593449od-w480_h360_x2.webp?w=1080&q=75, http://ap.rdcpix.com/038212e018bf10d9526aa024d0566866l-m767160745od-w480_h360_x2.webp?w=1080&q=75, http://ap.rdcpix.com/038212e018bf10d9526aa024d0566866l-m664787072od-w480_h360_x2.webp?w=1080&q=75, http://ap.rdcpix.com/038212e018bf10d9526aa024d0566866l-m3712304173od-w480_h360_x2.webp?w=1080&q=75, http://ap.rdcpix.com/038212e018bf10d9526aa024d0566866l-m2492653340od-w480_h360_x2.webp?w=1080&q=75, http://ap.rdcpix.com/038212e018bf10d9526aa024d0566866l-m3675416236od-w480_h360_x2.webp?w=1080&q=75, http://ap.rdcpix.com/038212e018bf10d9526aa024d0566866l-m3082865438od-w480_h360_x2.webp?w=1080&q=75, http://ap.rdcpix.com/038212e018bf10d9526aa024d0566866l-m3354896919od-w480_h360_x2.webp?w=1080&q=75"
