property_url,property_id,listing_id,mls,mls_id,status,text,style,full_street_line,street,unit,city,state,zip_code,beds,full_baths,half_baths,sqft,year_built,days_on_mls,list_price,list_price_min,list_price_max,list_date,sold_price,last_sold_date,assessed_value,estimated_value,tax,tax_history,new_construction,lot_sqft,price_per_sqft,latitude,longitude,neighborhoods,county,fips_code,stories,hoa_fee,parking_garage,agent_id,agent_name,agent_email,agent_phones,agent_mls_set,agent_nrds_id,broker_id,broker_name,builder_id,builder_name,office_id,office_mls_set,office_name,office_email,office_phones,nearby_schools,primary_photo,alt_photos
https://www.realtor.com/realestateandhomes-detail/5925-Mantalcino-Dr_Round-Rock_TX_78665_M79252-74011,7925274011,2978096469,AUTX,4638604,FOR_SALE,"Welcome to this warm and inviting 4-bedroom, 3.5-bathroom home in the beautiful Siena community of Round Rock. Thoughtfully designed with tall, airy ceilings in the family room, this 2, 900 sq. ft. home exudes charm and comfort. The open-concept kitchen, which flows effortlessly into the living space, is both functional and welcominga perfect spot for gathering with loved ones. Pride of ownership shines throughout, with well-maintained spaces, thoughtful details, and cozy nooks that make this house feel like home. Whether you're enjoying a quiet evening in or hosting friends, this home offers a warm and inviting atmosphere. ?? Nestled in a fantastic location, Siena offers the perfect blend of tranquility and convenience. Youre just minutes from shopping, dining, and everyday essentials, while also being close to local favorites like Salt Lick BBQ, Round Rock Express baseball games, and Kalaharithe largest indoor water park in Texas. Plus, with easy access to major highways and toll roads, getting anywhere in the Austin metro area is a breeze. If youve been looking for a place with character, comfort, and a true sense of home, this is the one. Come see it this weekend and experience the charm for yourself! ??",SINGLE_FAMILY,5925 Mantalcino Dr,5925 Mantalcino Dr,,Round Rock,TX,78665,4,3,1,2972,2017,2,469900,,,2025-02-07,,2022-07-01,492020,522000,11661,"[{'year': 2024, 'tax': 11661, 'assessment': {'building': 400020, 'land': 92000, 'total': 492020}}, {'year': 2023, 'tax': 12462, 'assessment': {'building': None, 'land': None, 'total': 389519}}, {'year': 2022, 'tax': 10529, 'assessment': {'building': None, 'land': None, 'total': 354108}}, {'year': 2021, 'tax': 10069, 'assessment': {'building': 260121, 'land': 61795, 'total': 321916}}, {'year': 2020, 'tax': 9570, 'assessment': {'building': 266096, 'land': 59934, 'total': 326030}}, {'year': 2019, 'tax': 10011, 'assessment': {'building': 267450, 'land': 54500, 'total': 321950}}, {'year': 2018, 'tax': 10349, 'assessment': {'building': 16400, 'land': 41000, 'total': 57400}}, {'year': 2017, 'tax': 1869, 'assessment': {'building': None, 'land': 36900, 'total': 36900}}]",False,7405,158,30.548383,-97.595491,,Williamson,48491,2,25,2,2031567,Paul Williams,paulwilliamsrealty@gmail.com,"[{'ext': None, 'primary': True, 'type': 'Mobile', 'number': '5127850186'}]",A-AUTX-629125,831005227,3685431,All City Real Estate -  Broker,,,2758370,O-AUTX-8137,All City Real Estate,kevin@kevinscanlan.com,"[{'number': '(512) 775-3846', 'type': 'Office', 'primary': True, 'ext': None}]","Hutto Independent School District, Orenda Charter School",http://ap.rdcpix.com/82bfcb9136186408007bdfe6340c9758l-m278563366od-w480_h360_x2.webp?w=1080&q=75,"http://ap.rdcpix.com/82bfcb9136186408007bdfe6340c9758l-m278563366od-w480_h360_x2.webp?w=1080&q=75, http://ap.rdcpix.com/82bfcb9136186408007bdfe6340c9758l-m4168611545od-w480_h360_x2.webp?w=1080&q=75, http://ap.rdcpix.com/82bfcb9136186408007bdfe6340c9758l-m3771810510od-w480_h360_x2.webp?w=1080&q=75, http://ap.rdcpix.com/82bfcb9136186408007bdfe6340c9758l-m1856002481od-w480_h360_x2.webp?w=1080&q=75, http://ap.rdcpix.com/82bfcb9136186408007bdfe6340c9758l-m422696484od-w480_h360_x2.webp?w=1080&q=75, http://ap.rdcpix.com/82bfcb9136186408007bdfe6340c9758l-m2947679666od-w480_h360_x2.webp?w=1080&q=75, http://ap.rdcpix.com/82bfcb9136186408007bdfe6340c9758l-m2307266689od-w480_h360_x2.webp?w=1080&q=75, http://ap.rdcpix.com/82bfcb9136186408007bdfe6340c9758l-m1833232235od-w480_h360_x2.webp?w=1080&q=75, http://ap.rdcpix.com/82bfcb9136186408007bdfe6340c9758l-m2355594681od-w480_h360_x2.webp?w=1080&q=75, http://ap.rdcpix.com/82bfcb9136186408007bdfe6340c9758l-m641721514od-w480_h360_x2.webp?w=1080&q=75, http://ap.rdcpix.com/82bfcb9136186408007bdfe6340c9758l-m1944512497od-w480_h360_x2.webp?w=1080&q=75, http://ap.rdcpix.com/82bfcb9136186408007bdfe6340c9758l-m2448325960od-w480_h360_x2.webp?w=1080&q=75, http://ap.rdcpix.com/82bfcb9136186408007bdfe6340c9758l-m549961952od-w480_h360_x2.webp?w=1080&q=75, http://ap.rdcpix.com/82bfcb9136186408007bdfe6340c9758l-m3549696123od-w480_h360_x2.webp?w=1080&q=75, http://ap.rdcpix.com/82bfcb9136186408007bdfe6340c9758l-m3691337020od-w480_h360_x2.webp?w=1080&q=75, http://ap.rdcpix.com/82bfcb9136186408007bdfe6340c9758l-m4280340197od-w480_h360_x2.webp?w=1080&q=75, http://ap.rdcpix.com/82bfcb9136186408007bdfe6340c9758l-m1834617258od-w480_h360_x2.webp?w=1080&q=75, http://ap.rdcpix.com/82bfcb9136186408007bdfe6340c9758l-m304388813od-w480_h360_x2.webp?w=1080&q=75, http://ap.rdcpix.com/82bfcb9136186408007bdfe6340c9758l-m3903320198od-w480_h360_x2.webp?w=1080&q=75, http://ap.rdcpix.com/82bfcb9136186408007bdfe6340c9758l-m875858693od-w480_h360_x2.webp?w=1080&q=75, http://ap.rdcpix.com/82bfcb9136186408007bdfe6340c9758l-m3639310023od-w480_h360_x2.webp?w=1080&q=75, http://ap.rdcpix.com/82bfcb9136186408007bdfe6340c9758l-m2187445937od-w480_h360_x2.webp?w=1080&q=75, http://ap.rdcpix.com/82bfcb9136186408007bdfe6340c9758l-m1390890357od-w480_h360_x2.webp?w=1080&q=75, http://ap.rdcpix.com/82bfcb9136186408007bdfe6340c9758l-m352664336od-w480_h360_x2.webp?w=1080&q=75, http://ap.rdcpix.com/82bfcb9136186408007bdfe6340c9758l-m707138289od-w480_h360_x2.webp?w=1080&q=75, http://ap.rdcpix.com/82bfcb9136186408007bdfe6340c9758l-m3959926447od-w480_h360_x2.webp?w=1080&q=75, http://ap.rdcpix.com/82bfcb9136186408007bdfe6340c9758l-m1634080718od-w480_h360_x2.webp?w=1080&q=75, http://ap.rdcpix.com/82bfcb9136186408007bdfe6340c9758l-m4077464145od-w480_h360_x2.webp?w=1080&q=75, http://ap.rdcpix.com/82bfcb9136186408007bdfe6340c9758l-m1088928698od-w480_h360_x2.webp?w=1080&q=75"
https://www.realtor.com/realestateandhomes-detail/2816-Saint-Federico-Way_Round-Rock_TX_78665_M73136-37146,7313637146,2978087597,AUTX,5496268,PENDING,"Welcome to this stunning single-story home in the highly sought-after Paloma Lake community of Round Rock. With beautiful front landscaping & spacious 3-car garage, this home boasts incredible curb appeal. Step inside & you're greeted by a soaring entryway with elegant tile flooring, setting the tone for the thoughtful design & luxurious touches found throughout. The open & inviting layout features high ceilings & LVP flooring that flows seamlessly through the main living areas & bedrooms. The spacious living room, complete with gas log fireplace & elegant coffered ceilings with crown molding is the perfect place to gather. The heart of the home is the gourmet kitchen, boasting an extended island, 42-inch cabinetry, & SS appliances. Adjacent to the kitchen, the formal dining area leads to one of two covered patios offering a seamless indoor-outdoor living experience. The private primary suite is a true retreat, featuring spacious sitting area ideal for a home gym or reading nook. The spa-like ensuite bathroom includes a luxurious soaker tub, walk-in shower with bench, dual vanities with dressing counter, & expansive walk-in closet. Two additional bedrooms provide plenty of space, while the upstairs game room - complete with adjoining powder bath, offers versatile bonus space. A dedicated laundry room with built-in storage & folding counter ensures both convenience & efficiency. Step outside to the screened-in back patio, perfect for year-round enjoyment. Beyond the patio, the fully fenced backyard offers privacy, lush landscaping & plenty of space for outdoor activities. Additional highlights include a water softener with filtration, tankless water heater, full gutters, & built-in shelving throughout. Thoughtfully maintained, this home boasts a new roof & HVAC, radiant barrier, & fresh exterior paint. This luxury home offers access to scenic trails, parks & top-rated RRISD schools. Dont miss the chance to experience this premier property!",SINGLE_FAMILY,2816 Saint Federico Way,2816 Saint Federico Way,,Round Rock,TX,78665,3,2,1,3016,2012,2,525000,,,2025-02-07,,,517461,594000,10965,"[{'year': 2024, 'tax': 10965, 'assessment': {'building': None, 'land': None, 'total': 517461}}, {'year': 2023, 'tax': 10811, 'assessment': {'building': None, 'land': None, 'total': 470419}}, {'year': 2022, 'tax': 10898, 'assessment': {'building': None, 'land': None, 'total': 427654}}, {'year': 2021, 'tax': 10758, 'assessment': {'building': 311713, 'land': 77063, 'total': 388776}}, {'year': 2020, 'tax': 9849, 'assessment': {'building': 315572, 'land': 70600, 'total': 386172}}, {'year': 2019, 'tax': 10189, 'assessment': {'building': 315604, 'land': 68908, 'total': 384512}}, {'year': 2018, 'tax': 11120, 'assessment': {'building': 319218, 'land': 64400, 'total': 383618}}, {'year': 2017, 'tax': 11410, 'assessment': {'building': 302418, 'land': 64400, 'total': 366818}}, {'year': 2016, 'tax': 10947, 'assessment': {'building': None, 'land': None, 'total': 336009}}, {'year': 2014, 'tax': 9127, 'assessment': {'building': 257563, 'land': 47900, 'total': 305463}}, {'year': 2013, 'tax': 10400, 'assessment': {'building': None, 'land': None, 'total': 26624}}, {'year': 2012, 'tax': 795}]",False,8560,174,30.555992,-97.618613,Paloma Lake,Williamson,48491,2,58,3,823008,Sonia Guardado,Sonia@MagnoliaRealty.com,"[{'ext': None, 'primary': True, 'type': 'Mobile', 'number': '5125072935'}]",A-AUTX-585758,831003731,,,,,,O-AUTX-701671,Magnolia Realty Round Rock,kristis@magnoliarealty.com,"[{'number': '(512) 402-5111', 'type': 'Office', 'primary': True, 'ext': None}]","Round Rock Independent School District, Orenda Charter School",http://ap.rdcpix.com/40ee590c4b6b72b10d664d2df8451047l-m2634409064od-w480_h360_x2.webp?w=1080&q=75,"http://ap.rdcpix.com/40ee590c4b6b72b10d664d2df8451047l-m2634409064od-w480_h360_x2.webp?w=1080&q=75, http://ap.rdcpix.com/40ee590c4b6b72b10d664d2df8451047l-m515734580od-w480_h360_x2.webp?w=1080&q=75, http://ap.rdcpix.com/40ee590c4b6b72b10d664d2df8451047l-m1132914936od-w480_h360_x2.webp?w=1080&q=75, http://ap.rdcpix.com/40ee590c4b6b72b10d664d2df8451047l-m772590921od-w480_h360_x2.webp?w=1080&q=75, http://ap.rdcpix.com/40ee590c4b6b72b10d664d2df8451047l-m171208843od-w480_h360_x2.webp?w=1080&q=75, http://ap.rdcpix.com/40ee590c4b6b72b10d664d2df8451047l-m1443114042od-w480_h360_x2.webp?w=1080&q=75, http://ap.rdcpix.com/40ee590c4b6b72b10d664d2df8451047l-m821056832od-w480_h360_x2.webp?w=1080&q=75, http://ap.rdcpix.com/40ee590c4b6b72b10d664d2df8451047l-m2838278888od-w480_h360_x2.webp?w=1080&q=75, http://ap.rdcpix.com/40ee590c4b6b72b10d664d2df8451047l-m1419673225od-w480_h360_x2.webp?w=1080&q=75, http://ap.rdcpix.com/40ee590c4b6b72b10d664d2df8451047l-m4217790895od-w480_h360_x2.webp?w=1080&q=75, http://ap.rdcpix.com/40ee590c4b6b72b10d664d2df8451047l-m3774399798od-w480_h360_x2.webp?w=1080&q=75, http://ap.rdcpix.com/40ee590c4b6b72b10d664d2df8451047l-m3967107078od-w480_h360_x2.webp?w=1080&q=75, http://ap.rdcpix.com/40ee590c4b6b72b10d664d2df8451047l-m600052029od-w480_h360_x2.webp?w=1080&q=75, http://ap.rdcpix.com/40ee590c4b6b72b10d664d2df8451047l-m3464644926od-w480_h360_x2.webp?w=1080&q=75, http://ap.rdcpix.com/40ee590c4b6b72b10d664d2df8451047l-m1075205325od-w480_h360_x2.webp?w=1080&q=75, http://ap.rdcpix.com/40ee590c4b6b72b10d664d2df8451047l-m2751915944od-w480_h360_x2.webp?w=1080&q=75, http://ap.rdcpix.com/40ee590c4b6b72b10d664d2df8451047l-m3314384014od-w480_h360_x2.webp?w=1080&q=75, http://ap.rdcpix.com/40ee590c4b6b72b10d664d2df8451047l-m2692434512od-w480_h360_x2.webp?w=1080&q=75, http://ap.rdcpix.com/40ee590c4b6b72b10d664d2df8451047l-m596158931od-w480_h360_x2.webp?w=1080&q=75, http://ap.rdcpix.com/40ee590c4b6b72b10d664d2df8451047l-m641225657od-w480_h360_x2.webp?w=1080&q=75, http://ap.rdcpix.com/40ee590c4b6b72b10d664d2df8451047l-m2770475336od-w480_h360_x2.webp?w=1080&q=75, http://ap.rdcpix.com/40ee590c4b6b72b10d664d2df8451047l-m3845320772od-w480_h360_x2.webp?w=1080&q=75, http://ap.rdcpix.com/40ee590c4b6b72b10d664d2df8451047l-m4271745395od-w480_h360_x2.webp?w=1080&q=75, http://ap.rdcpix.com/40ee590c4b6b72b10d664d2df8451047l-m2935454048od-w480_h360_x2.webp?w=1080&q=75, http://ap.rdcpix.com/40ee590c4b6b72b10d664d2df8451047l-m3952205684od-w480_h360_x2.webp?w=1080&q=75, http://ap.rdcpix.com/40ee590c4b6b72b10d664d2df8451047l-m2958647625od-w480_h360_x2.webp?w=1080&q=75, http://ap.rdcpix.com/40ee590c4b6b72b10d664d2df8451047l-m1784499688od-w480_h360_x2.webp?w=1080&q=75, http://ap.rdcpix.com/40ee590c4b6b72b10d664d2df8451047l-m3959410194od-w480_h360_x2.webp?w=1080&q=75, http://ap.rdcpix.com/40ee590c4b6b72b10d664d2df8451047l-m2278003184od-w480_h360_x2.webp?w=1080&q=75, http://ap.rdcpix.com/40ee590c4b6b72b10d664d2df8451047l-m1495476647od-w480_h360_x2.webp?w=1080&q=75, http://ap.rdcpix.com/40ee590c4b6b72b10d664d2df8451047l-m4113513279od-w480_h360_x2.webp?w=1080&q=75, http://ap.rdcpix.com/40ee590c4b6b72b10d664d2df8451047l-m11490412od-w480_h360_x2.webp?w=1080&q=75, http://ap.rdcpix.com/40ee590c4b6b72b10d664d2df8451047l-m1265637091od-w480_h360_x2.webp?w=1080&q=75, http://ap.rdcpix.com/40ee590c4b6b72b10d664d2df8451047l-m3576556608od-w480_h360_x2.webp?w=1080&q=75, http://ap.rdcpix.com/40ee590c4b6b72b10d664d2df8451047l-m1317270405od-w480_h360_x2.webp?w=1080&q=75, http://ap.rdcpix.com/40ee590c4b6b72b10d664d2df8451047l-m3260978178od-w480_h360_x2.webp?w=1080&q=75, http://ap.rdcpix.com/40ee590c4b6b72b10d664d2df8451047l-m3661975452od-w480_h360_x2.webp?w=1080&q=75, http://ap.rdcpix.com/40ee590c4b6b72b10d664d2df8451047l-m4093434417od-w480_h360_x2.webp?w=1080&q=75, http://ap.rdcpix.com/40ee590c4b6b72b10d664d2df8451047l-m592943848od-w480_h360_x2.webp?w=1080&q=75"
https://www.realtor.com/realestateandhomes-detail/5605-San-Michele-St_Round-Rock_TX_78665_M76376-72923,7637672923,2978090122,AUTX,4248282,FOR_SALE,"$12, 000 Buyer Incentives Available! Seller is offering up to $12, 000 towards a rate buy-down or buyer incentives to help make your home purchase more affordable! This stunning 3-bedroom, 3-bathroom home in the highly desirable Siena community in Round Rock is move-in ready and designed to accommodate both comfort and functionality. With a dedicated office, formal dining room, and a bright breakfast area, this home offers plenty of space to meet your work, dining, and relaxation needs. The expansive covered patio provides a perfect spot for outdoor gatherings, while the huge backyard offers endless possibilities for customization and personal touches. The homes layout is thoughtfully designed, with three full bathrooms ensuring convenience for both families and guests. The flow between formal and informal spaces makes it ideal for entertaining and everyday living. Outdoors, youll love relaxing on the patio and enjoying the spacious yard, with ample room for future projects or landscaping. Siena is a thriving community known for its beautifully maintained amenities, including parks, playgrounds, a community pool, and scenic walking trails. It is conveniently located just minutes from major attractions such as Dell Diamond, Kalahari Resorts & Conventions, and Old Settlers Park, providing plenty of opportunities for recreation and entertainment. In addition, Siena is close to major employers, shopping destinations like Round Rock Premium Outlets, and top-rated schools, making it one of the most attractive places to live in the area. Don't miss out on this exceptional home in one of Round Rock's most sought-after communities! Contact us today to schedule your showing.",SINGLE_FAMILY,5605 San Michele St,5605 San Michele St,,Round Rock,TX,78665,3,3,,2796,2018,2,485000,,,2025-02-07,,2018-08-27,423848,484451,10588,"[{'year': 2024, 'tax': 10588, 'assessment': {'building': None, 'land': None, 'total': 423848}}, {'year': 2023, 'tax': 10713, 'assessment': {'building': None, 'land': None, 'total': 385316}}, {'year': 2022, 'tax': 10415, 'assessment': {'building': None, 'land': None, 'total': 350287}}, {'year': 2021, 'tax': 9960, 'assessment': {'building': 256648, 'land': 61795, 'total': 318443}}, {'year': 2020, 'tax': 9467, 'assessment': {'building': 259771, 'land': 59934, 'total': 319705}}, {'year': 2019, 'tax': 9828, 'assessment': {'building': None, 'land': 54500, 'total': 54500}}, {'year': 2018, 'tax': 1745, 'assessment': {'building': None, 'land': 41000, 'total': 41000}}]",False,10925,173,30.543728,-97.603516,Siena,Williamson,48491,1,25,2,4123755,Clarissa Lopez,clardenia@gmail.com,,A-AUTX-655460,785039622,4458562,Keller Williams Realty -  Broker,,,612963,O-AUTX-0991,Keller Williams Realty,jdgrubb@kw.com,"[{'number': '(512) 448-4111', 'type': 'Home', 'primary': True, 'ext': None}]","Hutto Independent School District, Orenda Charter School",http://ap.rdcpix.com/ce5cff4f1cc1ddd84ef6dbb02177881el-m452202633od-w480_h360_x2.webp?w=1080&q=75,"http://ap.rdcpix.com/ce5cff4f1cc1ddd84ef6dbb02177881el-m452202633od-w480_h360_x2.webp?w=1080&q=75, http://ap.rdcpix.com/ce5cff4f1cc1ddd84ef6dbb02177881el-m3007240812od-w480_h360_x2.webp?w=1080&q=75, http://ap.rdcpix.com/ce5cff4f1cc1ddd84ef6dbb02177881el-m164526868od-w480_h360_x2.webp?w=1080&q=75, http://ap.rdcpix.com/ce5cff4f1cc1ddd84ef6dbb02177881el-m489673617od-w480_h360_x2.webp?w=1080&q=75, http://ap.rdcpix.com/ce5cff4f1cc1ddd84ef6dbb02177881el-m886099825od-w480_h360_x2.webp?w=1080&q=75, http://ap.rdcpix.com/ce5cff4f1cc1ddd84ef6dbb02177881el-m3774846898od-w480_h360_x2.webp?w=1080&q=75, http://ap.rdcpix.com/ce5cff4f1cc1ddd84ef6dbb02177881el-m2015977290od-w480_h360_x2.webp?w=1080&q=75, http://ap.rdcpix.com/ce5cff4f1cc1ddd84ef6dbb02177881el-m1275215467od-w480_h360_x2.webp?w=1080&q=75, http://ap.rdcpix.com/ce5cff4f1cc1ddd84ef6dbb02177881el-m402281914od-w480_h360_x2.webp?w=1080&q=75, http://ap.rdcpix.com/ce5cff4f1cc1ddd84ef6dbb02177881el-m2972446517od-w480_h360_x2.webp?w=1080&q=75, http://ap.rdcpix.com/ce5cff4f1cc1ddd84ef6dbb02177881el-m1227845297od-w480_h360_x2.webp?w=1080&q=75, http://ap.rdcpix.com/ce5cff4f1cc1ddd84ef6dbb02177881el-m23084191od-w480_h360_x2.webp?w=1080&q=75, http://ap.rdcpix.com/ce5cff4f1cc1ddd84ef6dbb02177881el-m2271084256od-w480_h360_x2.webp?w=1080&q=75, http://ap.rdcpix.com/ce5cff4f1cc1ddd84ef6dbb02177881el-m4060267923od-w480_h360_x2.webp?w=1080&q=75, http://ap.rdcpix.com/ce5cff4f1cc1ddd84ef6dbb02177881el-m1202058040od-w480_h360_x2.webp?w=1080&q=75"
https://www.realtor.com/realestateandhomes-detail/2156-Pearson-Way_Round-Rock_TX_78665_M79919-73997,7991973997,2978114101,AUTX,9562630,FOR_SALE,"Fantastic 4 bedroom single-story home within the established Settlers Crossing community. This well-maintained home includes wood floors and carpeted bedrooms with an open floor plan that welcomes family and friends. Upon entry, you'll be greeted by a huge formal dining room that would make a great home office. Make your way down the entry hall to the extra wide galley kitchen and a nice breakfast area. A half wall allows separation from the living room in the back of the home. The primary suite is also in the back corner of the house with a large walk-in closet in the bedroom. The ensuite bath offers a garden tub, a separate shower, and double vanity. The three additional bedrooms are all spacious and share a bathroom in the hall. The backyard is the place to be with its covered patio. Settlers Crossing is tucked away just across the street from Old Settlers Park and baseball fields. You're also just minutes away from Dell Diamond, Kalahari Waterpark and so much more that Round Rock has to offer!",SINGLE_FAMILY,2156 Pearson Way,2156 Pearson Way,,Round Rock,TX,78665,4,2,,2208,2003,1,375000,,,2025-02-08,,2004-06-28,391618,410000,6706,"[{'year': 2024, 'tax': 6706, 'assessment': {'building': 314218, 'land': 77400, 'total': 391618}}, {'year': 2023, 'tax': 7426, 'assessment': {'building': 384035, 'land': 77400, 'total': 461435}}, {'year': 2022, 'tax': 9661, 'assessment': {'building': 239878, 'land': 59400, 'total': 299278}}, {'year': 2021, 'tax': 6717, 'assessment': {'building': 194887, 'land': 56513, 'total': 251400}}, {'year': 2020, 'tax': 5675, 'assessment': {'building': 195101, 'land': 49498, 'total': 244599}}, {'year': 2019, 'tax': 5885, 'assessment': {'building': 188312, 'land': 49498, 'total': 237810}}, {'year': 2018, 'tax': 5850, 'assessment': {'building': 178402, 'land': 46260, 'total': 224662}}, {'year': 2017, 'tax': 5355, 'assessment': {'building': 166951, 'land': 46260, 'total': 213211}}, {'year': 2016, 'tax': 5008, 'assessment': {'building': 155306, 'land': 38070, 'total': 193376}}, {'year': 2014, 'tax': 4303, 'assessment': {'building': 149259, 'land': 33660, 'total': 182919}}, {'year': 2013, 'tax': 3823, 'assessment': {'building': None, 'land': None, 'total': 159028}}, {'year': 2012, 'tax': 3792, 'assessment': {'building': None, 'land': None, 'total': 156379}}, {'year': 2011, 'tax': 3682}, {'year': 2008, 'tax': 3692, 'assessment': {'building': None, 'land': None, 'total': 168938}}]",False,8712,170,30.546857,-97.620911,Settlers Crossing,Williamson,48491,1,33,2,1789932,Will Mackintosh,will@willmackintosh.com,"[{'ext': None, 'primary': True, 'type': 'Other', 'number': '5124969699'}, {'ext': None, 'primary': True, 'type': 'Mobile', 'number': '5124969699'}]",A-AUTX-483081,785031869,4562283,Bramlett Residential,,,2903721,O-AUTX-6290,Bramlett Residential,,"[{'number': '5128505717', 'type': 'Office', 'primary': True, 'ext': None}]",Round Rock Independent School District,http://ap.rdcpix.com/86762add94daeb855a52d5d2bb7a5860l-m1768831996od-w480_h360_x2.webp?w=1080&q=75,"http://ap.rdcpix.com/86762add94daeb855a52d5d2bb7a5860l-m1768831996od-w480_h360_x2.webp?w=1080&q=75, http://ap.rdcpix.com/86762add94daeb855a52d5d2bb7a5860l-m2139782756od-w480_h360_x2.webp?w=1080&q=75, http://ap.rdcpix.com/86762add94daeb855a52d5d2bb7a5860l-m3822718706od-w480_h360_x2.webp?w=1080&q=75, http://ap.rdcpix.com/86762add94daeb855a52d5d2bb7a5860l-m1702549573od-w480_h360_x2.webp?w=1080&q=75, http://ap.rdcpix.com/86762add94daeb855a52d5d2bb7a5860l-m2033419489od-w480_h360_x2.webp?w=1080&q=75, http://ap.rdcpix.com/86762add94daeb855a52d5d2bb7a5860l-m1416823968od-w480_h360_x2.webp?w=1080&q=75, http://ap.rdcpix.com/86762add94daeb855a52d5d2bb7a5860l-m3125205684od-w480_h360_x2.webp?w=1080&q=75, http://ap.rdcpix.com/86762add94daeb855a52d5d2bb7a5860l-m307227431od-w480_h360_x2.webp?w=1080&q=75, http://ap.rdcpix.com/86762add94daeb855a52d5d2bb7a5860l-m2937881982od-w480_h360_x2.webp?w=1080&q=75, http://ap.rdcpix.com/86762add94daeb855a52d5d2bb7a5860l-m2257329489od-w480_h360_x2.webp?w=1080&q=75, http://ap.rdcpix.com/86762add94daeb855a52d5d2bb7a5860l-m2879145994od-w480_h360_x2.webp?w=1080&q=75, http://ap.rdcpix.com/86762add94daeb855a52d5d2bb7a5860l-m2504965228od-w480_h360_x2.webp?w=1080&q=75, http://ap.rdcpix.com/86762add94daeb855a52d5d2bb7a5860l-m3344019507od-w480_h360_x2.webp?w=1080&q=75, http://ap.rdcpix.com/86762add94daeb855a52d5d2bb7a5860l-m3338827601od-w480_h360_x2.webp?w=1080&q=75, http://ap.rdcpix.com/86762add94daeb855a52d5d2bb7a5860l-m1576154209od-w480_h360_x2.webp?w=1080&q=75, http://ap.rdcpix.com/86762add94daeb855a52d5d2bb7a5860l-m596416521od-w480_h360_x2.webp?w=1080&q=75, http://ap.rdcpix.com/86762add94daeb855a52d5d2bb7a5860l-m796509499od-w480_h360_x2.webp?w=1080&q=75, http://ap.rdcpix.com/86762add94daeb855a52d5d2bb7a5860l-m1497728381od-w480_h360_x2.webp?w=1080&q=75, http://ap.rdcpix.com/86762add94daeb855a52d5d2bb7a5860l-m4080830910od-w480_h360_x2.webp?w=1080&q=75, http://ap.rdcpix.com/86762add94daeb855a52d5d2bb7a5860l-m3621118656od-w480_h360_x2.webp?w=1080&q=75, http://ap.rdcpix.com/86762add94daeb855a52d5d2bb7a5860l-m4047753299od-w480_h360_x2.webp?w=1080&q=75, http://ap.rdcpix.com/86762add94daeb855a52d5d2bb7a5860l-m1027882904od-w480_h360_x2.webp?w=1080&q=75, http://ap.rdcpix.com/86762add94daeb855a52d5d2bb7a5860l-m3607472897od-w480_h360_x2.webp?w=1080&q=75, http://ap.rdcpix.com/86762add94daeb855a52d5d2bb7a5860l-m2271875888od-w480_h360_x2.webp?w=1080&q=75, http://ap.rdcpix.com/86762add94daeb855a52d5d2bb7a5860l-m3082975658od-w480_h360_x2.webp?w=1080&q=75, http://ap.rdcpix.com/86762add94daeb855a52d5d2bb7a5860l-m3577762578od-w480_h360_x2.webp?w=1080&q=75"
